<?xml version="1.0" encoding="UTF-8"
?>
<!DOCTYPE devicePage SYSTEM "_menu.dtd" >
<!-- ftfl.xml -->

<devicePage xmlns:xi="http://www.w3.org/2001/XInclude" name="_instance" description="Flash Memory Module" >

   <aliasOption key="pflash_sector_size" constant="true"
      description="Sector size for program flash (minimum erase element)"/>

   <aliasOption key="pflash_phrase_size" constant="true"
      description="Phrase size for program flash (minimum program element)"/>

   <projectActionList id = "flash_files" >
      <copy source="Project_Headers/flash.h"                 target="Project_Headers/flash.h"                 replace="true"  derived="true" />
      <copy source="Project_Headers/ftfa.h"                  target="Project_Headers/ftfa.h"                  replace="true"  derived="true" />
      <copy source="Sources/ftfa.cpp"                        target="Sources/ftfa.cpp"                        replace="true"  derived="true" />
      <copy source="Snippets/flash_programming_example.cpp"  target="Snippets/flash_programming_example.cpp"  replace="true"  derived="true" />
   </projectActionList>

   <constant name="FlashType" id="/Flash/FlashType" key="/Flash/FlashType" value="ftfa" />
   
   <template><![CDATA[
      \t// Sector size for program flash (minimum erase element)
      \tstatic constexpr unsigned programFlashSectorSize = $(pflash_sector_size);\n\n
   
      \t// Phrase size for program flash (minimum programming element)
      \tstatic constexpr unsigned programFlashPhraseSize = $(pflash_phrase_size);\n\n
         
   ]]></template>

</devicePage>
