<?xml version="1.0" encoding="UTF-8"?>
<!DOCTYPE root SYSTEM "../_menu.dtd" >
<!-- MK22F51212_symbols.xml -->

<fragment xmlns:xi="http://www.w3.org/2001/XInclude">
   <!-- Definitions used by example programs -->
         <constant key="demo.cpp.led"                value="USBDM::GpioA&lt;1&gt;" /> <!-- Digital I/O generic LED -->
         <constant key="demo.cpp.pwm.led1"           value="ftm_LED_RED" />      <!-- FTM/TPM to LED -->
         <constant key="demo.cpp.pwm.led2"           value="ftm_LED_GREEN" />    <!-- FTM/TPM to LED -->
         <constant key="demo.cpp.red.led"            value="gpio_LED_RED" />     <!-- Digital I/O to LED -->
         <constant key="demo.cpp.green.led"          value="gpio_LED_GREEN" />   <!-- Digital I/O to LED -->
         <constant key="demo.cpp.blue.led"           value="gpio_LED_BLUE" />    <!-- Digital I/O to LED -->
         <constant key="demo.cpp.joystick.x"         value="adc_A2" />           <!-- Analogue I/O (Arduino) -->
         <constant key="demo.cpp.joystick.y"         value="adc_A1" />           <!-- Analogue I/O (Arduino) -->
         <constant key="demo.cpp.joystick.k"         value="gpio_A0" />          <!-- Digital I/O from switch (Arduino) -->
         <constant key="demo.cpp.external.switch"    value="gpio_A0" />          <!-- Digital I/O from switch (Arduino) -->
         <constant key="demo.cpp.external.led"       value="gpio_A1" />          <!-- Digital I/O to LED (Arduino) -->
         <constant key="demo.cpp.external.gps"       value="Gps2" />             <!-- GPS module connected by serial -->
         <constant key="demo.cpp.external.spi"       value="Spi1" />             <!-- SPI interface to off-board device -->
         <constant key="demo.cpp.external.i2c"       value="I2c1" />             <!-- I2C interface to off-board device -->
         <constant key="demo.cpp.mma845x.i2c"        value="I2c1" />             <!-- I2C interface to MMA845x -->
         <constant key="demo.cpp.fx0s8700cq.i2c"     value="I2c0" />             <!-- I2C interface to FX0S8700CQ -->
         <constant key="demo.cpp.mag3110.i2c"        value="I2c1" />             <!-- I2C interface to MAG3110 -->
         <constant key="demo.cpp.nrf24l01.spi"       value="Spi0" />             <!-- SPI interface to NRF24101 module -->
         <constant key="demo.cpp.nrf24l01.cs_n"      value="spi0_PCS1" />        <!-- CS* connection to NRF24101 module -->
         <constant key="demo.cpp.nrf24l01.ce"        value="GpioC&lt;11&gt;" />  <!-- CE* connection to NRF24101 module -->
         <constant key="demo.cpp.nrf24l01.irq"       value="GpioD&lt;0&gt;" />   <!-- IRQ* connection from NRF24101 module -->
</fragment>
